{
  "$schema": "https://json-schema.org/draft/2020-12/schema",
  "$id": "https://cpghero.com/schemas/product-match-review.schema.json",
  "title": "Retail Competitive Intelligence Product Match Review",
  "type": "object",
  "additionalProperties": false,
  "required": [
    "analysis_id",
    "product_pack_id",
    "product_pack_version",
    "revision",
    "future_application",
    "benchmark_retailer",
    "competitors",
    "profiles",
    "products",
    "connections",
    "summary"
  ],
  "properties": {
    "analysis_id": { "type": "string", "minLength": 1 },
    "product_pack_id": { "type": "string", "minLength": 1 },
    "product_pack_version": { "type": "string", "minLength": 1 },
    "revision_id": { "type": ["string", "null"], "format": "uuid" },
    "revision": { "type": "integer", "minimum": 0 },
    "current_publication_revision_id": {
      "type": ["string", "null"],
      "format": "uuid"
    },
    "staged_revision_id": { "type": ["string", "null"], "format": "uuid" },
    "future_application": {
      "oneOf": [
        { "type": "null" },
        {
          "type": "object",
          "additionalProperties": false,
          "required": ["revision_id", "revision"],
          "properties": {
            "revision_id": { "type": "string", "format": "uuid" },
            "revision": { "type": "integer", "minimum": 1 }
          }
        }
      ]
    },
    "benchmark_retailer": { "$ref": "#/$defs/retailer" },
    "competitors": {
      "type": "array",
      "items": { "$ref": "#/$defs/retailer" }
    },
    "profiles": {
      "type": "array",
      "items": { "$ref": "#/$defs/profile" }
    },
    "products": {
      "type": "array",
      "items": { "$ref": "#/$defs/product" }
    },
    "connections": {
      "type": "array",
      "items": { "$ref": "#/$defs/connection" }
    },
    "summary": {
      "type": "object",
      "additionalProperties": false,
      "required": ["suggested", "confirmed", "rejected", "unmatched"],
      "properties": {
        "suggested": { "type": "integer", "minimum": 0 },
        "confirmed": { "type": "integer", "minimum": 0 },
        "rejected": { "type": "integer", "minimum": 0 },
        "unmatched": { "type": "integer", "minimum": 0 },
        "ambiguous": { "type": "integer", "minimum": 0 }
      }
    }
  },
  "$defs": {
    "retailer": {
      "type": "object",
      "additionalProperties": false,
      "required": ["id", "name"],
      "properties": {
        "id": { "type": "string", "minLength": 1 },
        "name": { "type": "string", "minLength": 1 }
      }
    },
    "profile": {
      "type": "object",
      "additionalProperties": false,
      "required": ["id", "label", "geography", "comparison_metric"],
      "properties": {
        "id": { "type": "string", "minLength": 1 },
        "label": { "type": "string", "minLength": 1 },
        "geography": { "type": "string", "minLength": 1 },
        "comparison_metric": { "type": "string", "minLength": 1 }
        ,
        "default_scope_mode": {
          "enum": ["global", "observed_benchmark_product_footprint", "explicit_benchmark_locations"]
        },
        "allow_scoped_reuse": { "type": "boolean" }
      }
    },
    "product": {
      "type": "object",
      "additionalProperties": true,
      "required": ["retailer_id", "product_id", "canonical_product_id", "name"],
      "properties": {
        "retailer_id": { "type": "string", "minLength": 1 },
        "product_id": { "type": "string", "minLength": 1 },
        "canonical_product_id": { "type": "string", "minLength": 1 },
        "name": { "type": "string", "minLength": 1 },
        "brand": { "type": ["string", "null"] },
        "seller": { "type": ["string", "null"] },
        "image_url": { "type": ["string", "null"] },
        "url": { "type": ["string", "null"] },
        "description": { "type": ["string", "null"] },
        "category_path": {
          "oneOf": [
            { "type": "string" },
            { "type": "array", "items": { "type": "string" } },
            { "type": "null" }
          ]
        },
        "identifiers": { "type": "object" },
        "specification": { "type": "object" },
        "physical_properties": { "type": "object" },
        "variant_configuration": { "type": "object" },
        "item_condition": { "type": ["string", "null"] },
        "fulfillment": { "type": "object" },
        "reviews": { "type": "object" },
        "demand": { "type": "object" },
        "content": { "type": "object" },
        "relationships": { "type": "object" },
        "media": { "type": "object" },
        "pdp_source_field_inventory": {
          "type": "array",
          "uniqueItems": true,
          "items": { "type": "string", "minLength": 1 }
        },
        "pdp_unmapped_source_fields": {
          "type": "array",
          "uniqueItems": true,
          "items": { "type": "string", "minLength": 1 }
        },
        "pdp_reference_price": { "type": ["number", "null"] },
        "pdp_reference_currency": { "type": ["string", "null"] },
        "role": { "type": ["string", "null"] },
        "other_lens_participation": {
          "type": "array",
          "items": {
            "type": "object",
            "additionalProperties": false,
            "required": ["profile_id", "status"],
            "properties": {
              "profile_id": { "type": "string", "minLength": 1 },
              "status": {
                "enum": ["suggested", "confirmed", "rejected", "ambiguous"]
              }
            }
          }
        }
      }
    },
    "connection": {
      "type": "object",
      "additionalProperties": false,
      "required": [
        "competitor_retailer_id",
        "source_profile_id",
        "eligible_profile_ids",
        "benchmark_product_id",
        "competitor_product_id",
        "status",
        "origin",
        "match_basis",
        "profile_evidence"
      ],
      "properties": {
        "id": { "type": ["string", "null"] },
        "relationship_id": { "type": ["string", "null"] },
        "candidate_group_id": { "type": ["string", "null"] },
        "competitor_retailer_id": { "type": "string", "minLength": 1 },
        "source_profile_id": { "type": "string", "minLength": 1 },
        "eligible_profile_ids": {
          "type": "array",
          "minItems": 1,
          "uniqueItems": true,
          "items": { "type": "string", "minLength": 1 }
        },
        "benchmark_product_id": { "type": "string", "minLength": 1 },
        "competitor_product_id": { "type": "string", "minLength": 1 },
        "status": { "enum": ["suggested", "confirmed", "rejected", "ambiguous"] },
        "origin": { "enum": ["automatic", "user"] },
        "reason": { "type": ["string", "null"] },
        "matches": { "type": ["integer", "null"], "minimum": 0 },
        "geographies": { "type": ["integer", "null"], "minimum": 0 },
        "median_gap": { "type": ["number", "null"] }
        ,
        "qa_status": {
          "enum": ["ready", "review_required", "suppressed"]
        },
        "suppression_reasons": {
          "type": "array",
          "items": { "type": "string", "minLength": 1 }
        },
        "match_basis": {
          "enum": ["exact_package", "normalized_unit", "multiple", "user_defined"]
        },
        "profile_evidence": {
          "type": "array",
          "items": { "$ref": "#/$defs/profileEvidence" }
        },
        "scope": {
          "oneOf": [
            { "type": "null" },
            { "$ref": "product-match-scope.schema.json" }
          ]
        },
        "scope_summary": {
          "type": "object",
          "additionalProperties": false,
          "properties": {
            "eligible_locations": { "type": "integer", "minimum": 0 },
            "active_locations": { "type": "integer", "minimum": 0 },
            "conflict_locations": { "type": "integer", "minimum": 0 },
            "unmatched_locations": { "type": "integer", "minimum": 0 }
          }
        }
      }
    },
    "profileEvidence": {
      "type": "object",
      "additionalProperties": false,
      "required": [
        "profile_id",
        "profile_label",
        "comparison_metric",
        "match_basis",
        "match_attributes",
        "rationale"
      ],
      "properties": {
        "profile_id": { "type": "string", "minLength": 1 },
        "profile_label": { "type": "string", "minLength": 1 },
        "comparison_metric": { "type": "string", "minLength": 1 },
        "match_basis": { "enum": ["exact_package", "normalized_unit"] },
        "matches": { "type": ["integer", "null"], "minimum": 0 },
        "geographies": { "type": ["integer", "null"], "minimum": 0 },
        "median_gap": { "type": ["number", "null"] },
        "benchmark_median": { "type": ["number", "null"] },
        "competitor_median": { "type": ["number", "null"] },
        "price_unit": { "type": "string", "minLength": 1 },
        "price_source": { "const": "search" },
        "benchmark_median_statistic": { "const": "marginal_median" },
        "competitor_median_statistic": { "const": "marginal_median" },
        "median_gap_statistic": { "const": "paired_median_gap" },
        "match_attributes": { "type": "object" },
        "rationale": { "type": "string", "minLength": 1 }
      }
    }
  }
}
